{
  "schema_version": "1.0",
  "meta": {
    "slug": "freight-invoice-audit-agent",
    "name": "Freight Invoice Audit Agent",
    "one_liner": "AI agent that audits freight invoices against contracts and recovers the 2-5% shippers overpay.",
    "evaluated_at": "2026-08-06T12:00:00Z",
    "evaluator": "Claude (evaluate-startup) - ILLUSTRATIVE EXAMPLE, all data fictional",
    "skill_version": "0.1.0",
    "idea_source": "user interview",
    "custom_instructions": null,
    "tags": ["b2b", "logistics", "agentic", "fintech-adjacent"]
  },
  "idea": {
    "description": "Mid-market shippers (50-500 shipments/week) routinely overpay freight carriers due to billing errors: wrong accessorial charges, misapplied contract rates, duplicate invoices. Large enterprises employ audit firms; mid-market firms eat the loss. The agent ingests carrier invoices and rate contracts, flags discrepancies with evidence, and drafts dispute claims for human approval.",
    "target_customer": "Logistics or finance manager at a mid-market shipper with 50-500 shipments/week and no dedicated audit staff.",
    "value_proposition": "Recover 2-5% of freight spend with near-zero effort: forward invoices, approve flagged disputes, collect refunds.",
    "stage": "concept",
    "founder_context": "Solo technical founder, 8 years backend/ML, no logistics background but a warm contact at two regional shippers. Bootstrapping, 20 h/week alongside consulting.",
    "interview_notes": [
      { "q": "Walk me through the moment someone hits this problem.", "a": "AP clerk gets a 40-line carrier invoice, has no time to check line items against the rate contract PDF, approves it. Errors surface only in annual audits, if ever." },
      { "q": "Have you seen anyone pay to work around this?", "a": "Enterprises pay audit firms 30-50% contingency on recovered amounts. Mid-market firms told me the firms won't take them - too small." },
      { "q": "What's the failure you fear?", "a": "That contract parsing is too messy - every carrier contract is a differently-scanned PDF with amendments." }
    ]
  },
  "research": {
    "conducted_at": "2026-08-06",
    "angles": [
      {
        "id": "market",
        "title": "Market size & demand",
        "summary": "US mid-market freight audit is a genuinely underserved slice of a large spend pool; incumbent audit firms concentrate on enterprise contingency deals, leaving smaller shippers with no realistic option.",
        "findings": [
          "US business freight spend is measured in the high hundreds of billions annually; even fractions of a percent in billing errors represent a large recoverable pool (estimate).",
          "Industry rules of thumb place freight invoice error rates between 2% and 5% of spend (estimate, multiple secondary sources).",
          "Traditional audit firms typically require enterprise-scale volume, quoting minimums that exclude sub-500-shipments/week shippers.",
          "No dominant self-serve software product for contract-vs-invoice freight audit surfaced in searches; adjacent TMS platforms treat audit as a checkbox feature."
        ],
        "sources": [
          { "title": "Industry logistics spend overview (illustrative)", "note": "Supports total spend magnitude" },
          { "title": "Freight audit firm service pages (illustrative)", "note": "Supports contingency pricing and enterprise minimums" }
        ]
      },
      {
        "id": "competitors",
        "title": "Competitors & alternatives",
        "summary": "Competition is real but oblique: contingency audit firms (enterprise-only), TMS suites with shallow audit modules, and spreadsheets. Nobody owns the mid-market wedge with a product-shaped offer.",
        "findings": [
          "Contingency audit firms are the strongest analog and validate willingness to pay a revenue share for recovered money.",
          "TMS vendors could add deeper audit features, but their incentive is carrier-relationship-neutral workflow software, not adversarial auditing.",
          "The credible fast-follower threat is another AI startup, not an incumbent."
        ],
        "sources": [
          { "title": "TMS vendor feature comparisons (illustrative)", "note": "Supports shallow-audit-module claim" }
        ]
      },
      {
        "id": "technology",
        "title": "Technology & state of the art",
        "summary": "Invoice extraction is a solved problem at high accuracy; heterogeneous contract parsing (scanned PDFs, amendments, rate tables) is the hard 20% and the de-facto moat if cracked for the long tail of carrier formats.",
        "findings": [
          "Modern document AI reliably extracts line items from standard carrier invoice formats.",
          "Rate contracts are the messy side: multi-document amendments, embedded tables, carrier-specific accessorial codes.",
          "The audit computation itself (rate x lane x weight vs. billed) is deterministic once both sides are structured - ideal verifiability."
        ],
        "sources": [
          { "title": "Document AI benchmark literature (illustrative)", "note": "Supports extraction accuracy claims" }
        ]
      }
    ]
  },
  "assessment": {
    "categories": [
      {
        "id": "problem",
        "name": "Problem & Demand",
        "weight": 0.2,
        "score": 7.5,
        "confidence": "high",
        "summary": "Quantified, recurring money leak with proven willingness to pay a share of recovery - but the pain is silent (victims often don't know), which raises the education burden.",
        "dimensions": [
          { "id": "pain_intensity", "name": "Pain intensity", "score": 8, "rationale": "Direct, quantifiable financial loss; 2-5% of a core cost line is CFO-visible once surfaced." },
          { "id": "frequency_urgency", "name": "Frequency & urgency", "score": 8, "rationale": "Every invoice cycle, continuously; urgency is low only because the loss is invisible." },
          { "id": "problem_specificity", "name": "Problem specificity", "score": 8, "rationale": "Crisply nameable: billed amount deviates from contracted amount." },
          { "id": "demand_evidence", "name": "Demand evidence", "score": 6, "rationale": "Enterprises demonstrably pay contingency auditors; mid-market willingness inferred, not yet observed." }
        ],
        "sources": [
          { "title": "Freight audit firm service pages (illustrative)", "note": "Contingency model proves payment for recovery" }
        ]
      },
      {
        "id": "market",
        "name": "Market & Timing",
        "weight": 0.15,
        "score": 6.5,
        "confidence": "medium",
        "summary": "Comfortable niche rather than venture-scale headline; timing is good because document AI just crossed the accuracy bar that makes long-tail contract parsing economical.",
        "dimensions": [
          { "id": "reachable_market", "name": "Reachable market", "score": 6, "rationale": "Mid-market shipper audit is plausibly a low-hundreds-of-millions serviceable pool - solid for a focused company, not a land grab." },
          { "id": "growth_trajectory", "name": "Growth trajectory", "score": 7, "rationale": "Freight complexity and accessorial proliferation trend upward, growing the error surface." },
          { "id": "why_now", "name": "Why now", "score": 7, "rationale": "Contract-grade document AI became cheap enough to serve customers audit firms reject." },
          { "id": "tailwinds", "name": "Tailwinds", "score": 6, "rationale": "Margin pressure in logistics helps; no regulatory forcing function either way." }
        ],
        "sources": [
          { "title": "Industry logistics spend overview (illustrative)", "note": "Market magnitude" }
        ]
      },
      {
        "id": "leverage",
        "name": "Solution & Automation Leverage",
        "weight": 0.25,
        "score": 8.0,
        "confidence": "high",
        "summary": "Near-ideal agentic shape: deterministic verification core, cheap errors, fast feedback, clean decomposition. The one soft spot is getting clean contract data in.",
        "dimensions": [
          { "id": "outcome_verifiability", "name": "Outcome verifiability", "score": 9, "rationale": "Billed-vs-contracted is arithmetic once parsed; carrier accept/reject of disputes is a binary external ground truth." },
          { "id": "error_tolerance", "name": "Error tolerance", "score": 8, "rationale": "False positive costs a 5-minute human review before filing; no irreversible action is automated." },
          { "id": "feedback_loop_speed", "name": "Feedback loop speed", "score": 8, "rationale": "Parsing errors surface immediately; dispute outcomes return in days to weeks." },
          { "id": "scope_decomposability", "name": "Scope decomposability", "score": 8, "rationale": "Month-audit → invoice → line item → field extraction; each level independently checkable, errors caught before rolling up." },
          { "id": "data_context_availability", "name": "Data & context availability", "score": 7, "rationale": "Invoices arrive by email/EDI; contracts exist but as heterogeneous PDFs - accessible, messy." }
        ],
        "sources": [
          { "title": "Document AI benchmark literature (illustrative)", "note": "Extraction feasibility" }
        ]
      },
      {
        "id": "moat",
        "name": "Competition & Moat",
        "weight": 0.15,
        "score": 5.5,
        "confidence": "medium",
        "summary": "Wedge is open today, but durable defense must be earned: the carrier-format parsing corpus and dispute-outcome dataset compound, everything else is copyable.",
        "dimensions": [
          { "id": "competitive_intensity", "name": "Competitive intensity", "score": 5, "rationale": "No direct mid-market product found, but adjacent players abound and the idea is discoverable." },